[
  {
    "claim_id": "CPA-EVC-0001-I",
    "claim_type": "COMPOUND_EVIDENCE_STATE",
    "subject_id": "CPA-CAN-0001",
    "predicate": "HAS_IDENTITY_EVIDENCE_LEVEL",
    "evidence_lane": "identity",
    "level": "I2_REVIEW_CATALOGUED",
    "status": "ASSERTED_WITH_SOURCE",
    "source_ids": [
      "SRC-RADWAN-2021"
    ],
    "source_year": 2021,
    "source_url": "https://doi.org/10.3390/molecules26092774",
    "canonical_status": "BASELINE_2021_LOCKED",
    "note": ""
  },
  {
    "claim_id": "CPA-EVC-0001-O",
    "claim_type": "COMPOUND_EVIDENCE_STATE",
    "subject_id": "CPA-CAN-0001",
    "predicate": "HAS_OCCURRENCE_EVIDENCE_LEVEL",
    "evidence_lane": "occurrence",
    "level": "O1_REVIEW_CATALOGUED",
    "status": "ASSERTED_WITH_SOURCE",
    "source_ids": [
      "SRC-RADWAN-2021"
    ],
    "source_year": 2021,
    "source_url": "https://doi.org/10.3390/molecules26092774",
    "canonical_status": "BASELINE_2021_LOCKED",
    "note": ""
  },
  {
    "claim_id": "CPA-EVC-0002-I",
    "claim_type": "COMPOUND_EVIDENCE_STATE",
    "subject_id": "CPA-CAN-0002",
    "predicate": "HAS_IDENTITY_EVIDENCE_LEVEL",
    "evidence_lane": "identity",
    "level": "I2_REVIEW_CATALOGUED",
    "status": "ASSERTED_WITH_SOURCE",
    "source_ids": [
      "SRC-RADWAN-2021"
    ],
    "source_year": 2021,
    "source_url": "https://doi.org/10.3390/molecules26092774",
    "canonical_status": "BASELINE_2021_LOCKED",
    "note": ""
  },
  {
    "claim_id": "CPA-EVC-0002-O",
    "claim_type": "COMPOUND_EVIDENCE_STATE",
    "subject_id": "CPA-CAN-0002",
    "predicate": "HAS_OCCURRENCE_EVIDENCE_LEVEL",
    "evidence_lane": "occurrence",
    "level": "O1_REVIEW_CATALOGUED",
    "status": "ASSERTED_WITH_SOURCE",
    "source_ids": [
      "SRC-RADWAN-2021"
    ],
    "source_year": 2021,
    "source_url": "https://doi.org/10.3390/molecules26092774",
    "canonical_status": "BASELINE_2021_LOCKED",
    "note": ""
  },
  {
    "claim_id": "CPA-EVC-0003-I",
    "claim_type": "COMPOUND_EVIDENCE_STATE",
    "subject_id": "CPA-CAN-0003",
    "predicate": "HAS_IDENTITY_EVIDENCE_LEVEL",
    "evidence_lane": "identity",
    "level": "I2_REVIEW_CATALOGUED",
    "status": "ASSERTED_WITH_SOURCE",
    "source_ids": [
      "SRC-RADWAN-2021"
    ],
    "source_year": 2021,
    "source_url": "https://doi.org/10.3390/molecules26092774",
    "canonical_status": "BASELINE_2021_LOCKED",
    "note": ""
  },
  {
    "claim_id": "CPA-EVC-0003-O",
    "claim_type": "COMPOUND_EVIDENCE_STATE",
    "subject_id": "CPA-CAN-0003",
    "predicate": "HAS_OCCURRENCE_EVIDENCE_LEVEL",
    "evidence_lane": "occurrence",
    "level": "O1_HISTORICAL_OCCURRENCE_CONTESTED",
    "status": "CAUTIONED",
    "source_ids": [
      "SRC-RADWAN-2021"
    ],
    "source_year": 2021,
    "source_url": "https://doi.org/10.3390/molecules26092774",
    "canonical_status": "BASELINE_2021_LOCKED",
    "note": "THCA-B is historically catalogued, but later review literature notes subsequent studies did not confirm its occurrence."
  },
  {
    "claim_id": "CPA-EVC-0004-I",
    "claim_type": "COMPOUND_EVIDENCE_STATE",
    "subject_id": "CPA-CAN-0004",
    "predicate": "HAS_IDENTITY_EVIDENCE_LEVEL",
    "evidence_lane": "identity",
    "level": "I2_REVIEW_CATALOGUED",
    "status": "ASSERTED_WITH_SOURCE",
    "source_ids": [
      "SRC-RADWAN-2021"
    ],
    "source_year": 2021,
    "source_url": "https://doi.org/10.3390/molecules26092774",
    "canonical_status": "BASELINE_2021_LOCKED",
    "note": ""
  },
  {
    "claim_id": "CPA-EVC-0004-O",
    "claim_type": "COMPOUND_EVIDENCE_STATE",
    "subject_id": "CPA-CAN-0004",
    "predicate": "HAS_OCCURRENCE_EVIDENCE_LEVEL",
    "evidence_lane": "occurrence",
    "level": "O1_REVIEW_CATALOGUED",
    "status": "ASSERTED_WITH_SOURCE",
    "source_ids": [
      "SRC-RADWAN-2021"
    ],
    "source_year": 2021,
    "source_url": "https://doi.org/10.3390/molecules26092774",
    "canonical_status": "BASELINE_2021_LOCKED",
    "note": ""
  },
  {
    "claim_id": "CPA-EVC-0005-I",
    "claim_type": "COMPOUND_EVIDENCE_STATE",
    "subject_id": "CPA-CAN-0005",
    "predicate": "HAS_IDENTITY_EVIDENCE_LEVEL",
    "evidence_lane": "identity",
    "level": "I2_REVIEW_CATALOGUED",
    "status": "ASSERTED_WITH_SOURCE",
    "source_ids": [
      "SRC-RADWAN-2021"
    ],
    "source_year": 2021,
    "source_url": "https://doi.org/10.3390/molecules26092774",
    "canonical_status": "BASELINE_2021_LOCKED",
    "note": ""
  },
  {
    "claim_id": "CPA-EVC-0005-O",
    "claim_type": "COMPOUND_EVIDENCE_STATE",
    "subject_id": "CPA-CAN-0005",
    "predicate": "HAS_OCCURRENCE_EVIDENCE_LEVEL",
    "evidence_lane": "occurrence",
    "level": "O1_REVIEW_CATALOGUED",
    "status": "ASSERTED_WITH_SOURCE",
    "source_ids": [
      "SRC-RADWAN-2021"
    ],
    "source_year": 2021,
    "source_url": "https://doi.org/10.3390/molecules26092774",
    "canonical_status": "BASELINE_2021_LOCKED",
    "note": ""
  },
  {
    "claim_id": "CPA-EVC-0006-I",
    "claim_type": "COMPOUND_EVIDENCE_STATE",
    "subject_id": "CPA-CAN-0006",
    "predicate": "HAS_IDENTITY_EVIDENCE_LEVEL",
    "evidence_lane": "identity",
    "level": "I2_REVIEW_CATALOGUED",
    "status": "ASSERTED_WITH_SOURCE",
    "source_ids": [
      "SRC-RADWAN-2021"
    ],
    "source_year": 2021,
    "source_url": "https://doi.org/10.3390/molecules26092774",
    "canonical_status": "BASELINE_2021_LOCKED",
    "note": ""
  },
  {
    "claim_id": "CPA-EVC-0006-O",
    "claim_type": "COMPOUND_EVIDENCE_STATE",
    "subject_id": "CPA-CAN-0006",
    "predicate": "HAS_OCCURRENCE_EVIDENCE_LEVEL",
    "evidence_lane": "occurrence",
    "level": "O1_REVIEW_CATALOGUED",
    "status": "ASSERTED_WITH_SOURCE",
    "source_ids": [
      "SRC-RADWAN-2021"
    ],
    "source_year": 2021,
    "source_url": "https://doi.org/10.3390/molecules26092774",
    "canonical_status": "BASELINE_2021_LOCKED",
    "note": ""
  },
  {
    "claim_id": "CPA-EVC-0007-I",
    "claim_type": "COMPOUND_EVIDENCE_STATE",
    "subject_id": "CPA-CAN-0007",
    "predicate": "HAS_IDENTITY_EVIDENCE_LEVEL",
    "evidence_lane": "identity",
    "level": "I2_REVIEW_CATALOGUED",
    "status": "ASSERTED_WITH_SOURCE",
    "source_ids": [
      "SRC-RADWAN-2021"
    ],
    "source_year": 2021,
    "source_url": "https://doi.org/10.3390/molecules26092774",
    "canonical_status": "BASELINE_2021_LOCKED",
    "note": ""
  },
  {
    "claim_id": "CPA-EVC-0007-O",
    "claim_type": "COMPOUND_EVIDENCE_STATE",
    "subject_id": "CPA-CAN-0007",
    "predicate": "HAS_OCCURRENCE_EVIDENCE_LEVEL",
    "evidence_lane": "occurrence",
    "level": "O1_REVIEW_CATALOGUED",
    "status": "ASSERTED_WITH_SOURCE",
    "source_ids": [
      "SRC-RADWAN-2021"
    ],
    "source_year": 2021,
    "source_url": "https://doi.org/10.3390/molecules26092774",
    "canonical_status": "BASELINE_2021_LOCKED",
    "note": ""
  },
  {
    "claim_id": "CPA-EVC-0008-I",
    "claim_type": "COMPOUND_EVIDENCE_STATE",
    "subject_id": "CPA-CAN-0008",
    "predicate": "HAS_IDENTITY_EVIDENCE_LEVEL",
    "evidence_lane": "identity",
    "level": "I2_REVIEW_CATALOGUED",
    "status": "ASSERTED_WITH_SOURCE",
    "source_ids": [
      "SRC-RADWAN-2021"
    ],
    "source_year": 2021,
    "source_url": "https://doi.org/10.3390/molecules26092774",
    "canonical_status": "BASELINE_2021_LOCKED",
    "note": ""
  },
  {
    "claim_id": "CPA-EVC-0008-O",
    "claim_type": "COMPOUND_EVIDENCE_STATE",
    "subject_id": "CPA-CAN-0008",
    "predicate": "HAS_OCCURRENCE_EVIDENCE_LEVEL",
    "evidence_lane": "occurrence",
    "level": "O1_REVIEW_CATALOGUED",
    "status": "ASSERTED_WITH_SOURCE",
    "source_ids": [
      "SRC-RADWAN-2021"
    ],
    "source_year": 2021,
    "source_url": "https://doi.org/10.3390/molecules26092774",
    "canonical_status": "BASELINE_2021_LOCKED",
    "note": ""
  },
  {
    "claim_id": "CPA-EVC-0009-I",
    "claim_type": "COMPOUND_EVIDENCE_STATE",
    "subject_id": "CPA-CAN-0009",
    "predicate": "HAS_IDENTITY_EVIDENCE_LEVEL",
    "evidence_lane": "identity",
    "level": "I2_REVIEW_CATALOGUED",
    "status": "ASSERTED_WITH_SOURCE",
    "source_ids": [
      "SRC-RADWAN-2021"
    ],
    "source_year": 2021,
    "source_url": "https://doi.org/10.3390/molecules26092774",
    "canonical_status": "BASELINE_2021_LOCKED",
    "note": ""
  },
  {
    "claim_id": "CPA-EVC-0009-O",
    "claim_type": "COMPOUND_EVIDENCE_STATE",
    "subject_id": "CPA-CAN-0009",
    "predicate": "HAS_OCCURRENCE_EVIDENCE_LEVEL",
    "evidence_lane": "occurrence",
    "level": "O1_REVIEW_CATALOGUED",
    "status": "ASSERTED_WITH_SOURCE",
    "source_ids": [
      "SRC-RADWAN-2021"
    ],
    "source_year": 2021,
    "source_url": "https://doi.org/10.3390/molecules26092774",
    "canonical_status": "BASELINE_2021_LOCKED",
    "note": ""
  },
  {
    "claim_id": "CPA-EVC-0010-I",
    "claim_type": "COMPOUND_EVIDENCE_STATE",
    "subject_id": "CPA-CAN-0010",
    "predicate": "HAS_IDENTITY_EVIDENCE_LEVEL",
    "evidence_lane": "identity",
    "level": "I2_REVIEW_CATALOGUED",
    "status": "ASSERTED_WITH_SOURCE",
    "source_ids": [
      "SRC-RADWAN-2021"
    ],
    "source_year": 2021,
    "source_url": "https://doi.org/10.3390/molecules26092774",
    "canonical_status": "BASELINE_2021_LOCKED",
    "note": ""
  },
  {
    "claim_id": "CPA-EVC-0010-O",
    "claim_type": "COMPOUND_EVIDENCE_STATE",
    "subject_id": "CPA-CAN-0010",
    "predicate": "HAS_OCCURRENCE_EVIDENCE_LEVEL",
    "evidence_lane": "occurrence",
    "level": "O1_REVIEW_CATALOGUED",
    "status": "ASSERTED_WITH_SOURCE",
    "source_ids": [
      "SRC-RADWAN-2021"
    ],
    "source_year": 2021,
    "source_url": "https://doi.org/10.3390/molecules26092774",
    "canonical_status": "BASELINE_2021_LOCKED",
    "note": ""
  },
  {
    "claim_id": "CPA-EVC-0011-I",
    "claim_type": "COMPOUND_EVIDENCE_STATE",
    "subject_id": "CPA-CAN-0011",
    "predicate": "HAS_IDENTITY_EVIDENCE_LEVEL",
    "evidence_lane": "identity",
    "level": "I2_REVIEW_CATALOGUED",